{
  "in_menu": true,
  "metadata": {
    "title": "無料フォントジェネレーター - オンラインでカスタムフォントを作成 | Toolaze",
    "description": "オンラインで無料でカスタムフォントを生成。筆記体、装飾、太字、イタリック、ゴシック、タトゥーフォントを作成。即座にコピー＆ペースト。登録不要。"
  },
  "sectionsOrder": [
    "howToUse",
    "features",
    "intro",
    "performanceMetrics",
    "comparison",
    "scenes",
    "rating",
    "faq"
  ],
  "hero": {
    "h1": "無料 <span class=\"text-gradient\">フォントジェネレーター</span>",
    "desc": "オンラインで無料でカスタムフォントを生成。筆記体、装飾、太字、イタリック、ゴシック、タトゥーフォントを作成。即座にコピー＆ペースト。登録不要。"
  },
  "intro": {
    "title": "なぜToolazeフォントジェネレーターを使用するのか？",
    "content": [
      {
        "title": "フォントジェネレーターとは？",
        "text": "フォントジェネレーターは、Unicode文字を使用してプレーンテキストをスタイル付きテキストに変換するオンラインツールです。フォントをインストールしたり、デザインソフトウェアを使用したりすることなく、美しく独特なテキストスタイルを作成できます。フォントジェネレーターは、ソーシャルメディアの投稿、デザインプロジェクト、テキストに視覚的な魅力を加えたいあらゆる場所に最適です。人気の<a href=\"/font-generator/cursive\" class=\"text-indigo-600 hover:text-purple-600 font-semibold underline decoration-2 underline-offset-2\">筆記体フォントジェネレーター</a>、<a href=\"/font-generator/fancy\" class=\"text-indigo-600 hover:text-purple-600 font-semibold underline decoration-2 underline-offset-2\">装飾フォントジェネレーター</a>、または太字フォントジェネレーターをお試しください。"
      },
      {
        "title": "なぜオンラインでフォントを生成するのか？",
        "text": "スタイル付きテキストを手動で作成するには、デザインソフトウェア、フォントのインストール、技術的な知識が必要です。当社のフォントジェネレーターを使用すると、ソフトウェアをダウンロードしたり、フォントをインストールしたりすることなく、あらゆるテキストを複数の美しいスタイル（筆記体、装飾、太字、イタリック、ゴシック、タトゥーなど）に即座に変換できます。Instagramのバイオ、Facebookの投稿、TikTokのキャプションに独特なテキストを求めているソーシャルメディアユーザーや、モックアップやプレゼンテーション用に迅速なスタイル付きテキストを必要とするデザイナーに最適です。特定のスタイルについては、<a href=\"/font-generator/tattoo\" class=\"text-indigo-600 hover:text-purple-600 font-semibold underline decoration-2 underline-offset-2\">タトゥーフォントジェネレーター</a>、Instagramフォントジェネレーター、またはゴシックフォントジェネレーターをご覧ください。"
      }
    ]
  },
  "features": {
    "title": "強力なフォントジェネレーター機能",
    "items": [
      {
        "icon": "🎨",
        "iconType": "quality",
        "title": "複数のフォントスタイル",
        "desc": "筆記体、装飾、太字、イタリック、ゴシック、タトゥー、カリグラフィー、オールドイングリッシュ、3Dなど、複数のフォントスタイルで美しいテキストを生成します。"
      },
      {
        "icon": "🔒",
        "iconType": "privacy",
        "title": "完全なプライバシー保護",
        "desc": "すべてのフォント生成はブラウザ内でローカルに実行されます。テキストがデバイスを離れることはなく、絶対的なデータセキュリティを確保します。"
      },
      {
        "icon": "⚡",
        "iconType": "speed",
        "title": "即座の生成",
        "desc": "リアルタイムプレビューでテキストをスタイル付きフォントに即座に変換します。待機時間や遅延はありません。"
      },
      {
        "icon": "📋",
        "iconType": "batch",
        "title": "簡単なコピー＆ペースト",
        "desc": "ワンクリックでスタイル付きテキストをコピーし、Instagram、Facebook、Twitter、TikTok、Discord、またはその他のプラットフォームに直接貼り付けます。"
      },
      {
        "icon": "💎",
        "iconType": "free",
        "title": "無料",
        "desc": "完全に無料で無制限のフォント生成をお楽しみください。サブスクリプション、隠れた料金、広告は一切ありません。"
      },
      {
        "icon": "🌐",
        "iconType": "browser",
        "title": "インストール不要",
        "desc": "クライアントサイド技術を使用して、すべてがWebブラウザで直接実行されます。ソフトウェアのダウンロードやフォントのインストールは不要です。"
      }
    ]
  },
  "specs": {
    "engine": "ブラウザネイティブフォントレンダリング - クライアントサイド処理",
    "limit": "無制限のテキスト長 - 文字数制限なし",
    "logic": "リアルタイムプレビュー（即座のスタイル適用）",
    "privacy": "100%クライアントサイド（ローカルブラウザ処理）"
  },
  "performanceMetrics": {
    "title": "技術仕様",
    "metrics": [
      {
        "label": "フォントスタイル",
        "value": "筆記体、装飾、太字、イタリック、ゴシック、タトゥー、カリグラフィー、オールドイングリッシュ、3Dなど"
      },
      {
        "label": "テキスト長",
        "value": "無制限の文字数"
      },
      {
        "label": "処理速度",
        "value": "即座（リアルタイムプレビュー）"
      },
      {
        "label": "出力形式",
        "value": "Unicodeテキスト（コピー＆ペースト準備完了）"
      },
      {
        "label": "プラットフォームサポート",
        "value": "Instagram、Facebook、Twitter、TikTok、Discord、WhatsAppなど"
      },
      {
        "label": "処理場所",
        "value": "100%クライアントサイド（ブラウザJavaScript）"
      },
      {
        "label": "プライバシー",
        "value": "サーバーアップロードなし、完全なローカル処理"
      }
    ]
  },
  "howToUse": {
    "title": "Toolazeフォントジェネレーターの使い方",
    "steps": [
      {
        "title": "テキストを入力",
        "desc": "上記の入力フィールドに、カスタムフォントスタイルに変換したいテキストを入力します。"
      },
      {
        "title": "フォントスタイルを選択",
        "desc": "筆記体、装飾、太字、イタリック、ゴシック、タトゥーなど、複数のフォントスタイルから選択します。リアルタイムでテキストをプレビューして、見た目を確認します。"
      },
      {
        "title": "コピー＆ペースト",
        "desc": "コピーボタンをクリックしてスタイル付きテキストをコピーし、ソーシャルメディア、ドキュメント、またはデザインツールに貼り付けます。"
      }
    ]
  },
  "comparison": {
    "title": "なぜToolazeを選ぶのか？",
    "toolaze": "Toolaze 💎",
    "others": "Other Tools",
    "vs": "VS",
    "smartChoice": "スマートな選択",
    "otherTools": "他のツール",
    "toolazeFeatures": "無制限のテキスト長、複数のフォントスタイル、即座のプレビュー、リアルタイム生成、100%ローカル処理、アップロードなし、無料",
    "othersFeatures": "文字数制限、限られたスタイル、処理が遅い、サーバーアップロードが必要、クラウドキュー、プライバシーの懸念、有料アップグレード"
  },
  "scenesTitle": "使用例",
  "scenes": [
    {
      "title": "ソーシャルメディアユーザー向け",
      "icon": "📱",
      "desc": "Instagram、Facebook、Twitter、TikTokの投稿用に目を引くフォントを作成します。ブランドに合ったカスタムスタイル付きテキストで差別化します。"
    },
    {
      "title": "デザイナー向け",
      "icon": "🎨",
      "desc": "デザインプロジェクト、ロゴ、ブランディング素材用のフォントを生成します。デザインを確定する前に、さまざまなスタイルを即座にプレビューします。"
    },
    {
      "title": "コンテンツクリエイター向け",
      "icon": "💼",
      "desc": "YouTubeのサムネイル、ブログ投稿、マーケティング素材用のカスタムフォントでコンテンツを強化します。どこにでもコピー＆ペーストできます。"
    }
  ],
  "rating": {
    "title": "何千人ものクリエイターに信頼されています",
    "rating": "4.9/5 10,000人以上のクリエイターから",
    "text": "\"見つけた中で最高のフォントジェネレーターです。即座に結果が得られ、Instagramで完璧に動作します！\" - 美しいフォント生成のためにToolazeを信頼する何千人ものユーザーに参加してください。"
  },
  "faqTitle": "よくある質問",
  "faq": [
    {
      "q": "どのようなフォントスタイルが利用可能ですか？",
      "a": "Toolazeは、<a href=\"/font-generator/cursive\" class=\"text-indigo-600 hover:text-purple-600 font-semibold underline decoration-2 underline-offset-2\">筆記体フォントジェネレーター</a>、<a href=\"/font-generator/fancy\" class=\"text-indigo-600 hover:text-purple-600 font-semibold underline decoration-2 underline-offset-2\">装飾フォントジェネレーター</a>、太字、イタリック、ゴシック、タトゥー、カリグラフィー、オールドイングリッシュ、3Dなど、複数のフォントスタイルをサポートしています。利用可能なすべてのスタイルをリアルタイムでプレビューできます。"
    },
    {
      "q": "このフォントジェネレーターは本当に無料ですか？",
      "a": "はい！Toolazeは100%無料で、広告、登録、隠れた料金は一切ありません。すべてのフォント生成はブラウザ内で実行されます。"
    },
    {
      "q": "これらのフォントをソーシャルメディアで使用できますか？",
      "a": "はい、生成されたフォントをコピー＆ペーストして、Instagram、Facebook、Twitter、TikTok、Discord、およびUnicode文字をサポートするその他のプラットフォームで使用できます。プラットフォーム固有のフォントについては、<a href=\"/font-generator/instagram\" class=\"text-indigo-600 hover:text-purple-600 font-semibold underline decoration-2 underline-offset-2\">Instagramフォントジェネレーター</a>または<a href=\"/font-generator/discord\" class=\"text-indigo-600 hover:text-purple-600 font-semibold underline decoration-2 underline-offset-2\">Discordフォントジェネレーター</a>をお試しください。"
    },
    {
      "q": "テキストはサーバーにアップロードされますか？",
      "a": "いいえ！すべてのフォント生成は、JavaScriptを使用してブラウザ内でローカルに実行されます。テキストがデバイスを離れることはなく、完全なプライバシーを確保します。"
    },
    {
      "q": "フォントファイルをダウンロードできますか？",
      "a": "Toolazeは、コピー＆ペーストできるスタイル付きテキストを生成します。ダウンロード可能なフォントファイル（.ttf、.otf）は提供していませんが、生成されたテキストはどこでも使用できます。"
    },
    {
      "q": "文字数制限はありますか？",
      "a": "いいえ、文字数制限はありません。文、段落、またはドキュメント全体のスタイル付きテキストを生成できます。ジェネレーターは、長さに関係なく、テキストを即座に処理します。"
    }
  ],
  "moreTools": "その他のフォントジェネレーターツール"
}
