{
  "in_menu": true,
  "metadata": {
    "title": "表情符號複製貼上 - 免費線上複製表情符號 | Toolaze",
    "description": "免費線上複製並貼上表情符號。按類別瀏覽、搜尋、選擇膚色並立即複製。無需註冊。將表情符號複製並貼上到任何應用程式或社群媒體。"
  },
  "sectionsOrder": [
    "howToUse",
    "features",
    "intro",
    "performanceMetrics",
    "comparison",
    "scenes",
    "rating",
    "faq"
  ],
  "hero": {
    "h1": "表情符號 <span class=\"text-gradient\">複製與貼上</span>",
    "desc": "免費線上複製並貼上表情符號。按類別瀏覽、搜尋、選擇膚色，一鍵複製。無需註冊。"
  },
  "intro": {
    "title": "為什麼要使用 Toolaze 表情符號複製貼上工具？",
    "content": [
      {
        "title": "什麼是表情符號複製貼上？",
        "text": "表情符號複製貼上是一個免費的線上工具，讓您可以按類別瀏覽數千個表情符號、按關鍵字搜尋，並一鍵複製任何表情符號。您可以將表情符號複製並貼上到訊息、社群媒體、文件或任何其他地方。無需安裝應用程式或註冊——一切都在您的瀏覽器中運行。Toolaze 支援常用、表情與人物、動物與自然、食物與飲料、旅行與地點、活動、物品、符號和旗幟，讓您可以快速找到正確的表情符號。"
      },
      {
        "title": "為什麼要在線上複製貼上表情符號？",
        "text": "在手機或電腦上尋找並複製表情符號可能很慢或受到限制。使用 Toolaze，您可以在一個地方完成表情符號的複製貼上：按類別搜尋或瀏覽、在需要時選擇膚色，並立即複製。您最近使用的表情符號會儲存在本地，因此您可以複製並貼上常用的表情符號，而無需再次搜尋。非常適合簡訊、Discord、Instagram、TikTok 或任何支援 Unicode 表情符號的應用程式。"
      }
    ]
  },
  "features": {
    "title": "表情符號複製貼上功能",
    "items": [
      {
        "icon": "📂",
        "iconType": "quality",
        "title": "按類別瀏覽",
        "desc": "按類別瀏覽表情符號：表情與人物、動物與自然、食物與飲料、旅行與地點、活動、物品、符號和旗幟。從側邊欄快速跳轉到任何類別。"
      },
      {
        "icon": "🔍",
        "iconType": "speed",
        "title": "搜尋表情符號",
        "desc": "按關鍵字搜尋以快速找到正確的表情符號。輸入單字即可獲得匹配的表情符號，讓您在幾秒鐘內複製並貼上所需的表情符號。"
      },
      {
        "icon": "👋",
        "iconType": "quality",
        "title": "膚色選擇器",
        "desc": "為人物和手部表情符號選擇膚色。挑選您想要的變化，然後複製並貼上——無需額外步驟。"
      },
      {
        "icon": "📋",
        "iconType": "batch",
        "title": "一鍵複製",
        "desc": "點擊任何表情符號即可將其複製到剪貼簿。貼上到 WhatsApp、iMessage、Discord、Instagram、TikTok 或任何應用程式。無需下載，無需帳號。"
      },
      {
        "icon": "🔒",
        "iconType": "privacy",
        "title": "隱私優先",
        "desc": "所有的表情符號瀏覽和複製貼上都在您的瀏覽器中進行。您的最近使用列表儲存在本地——不會發送到我們的伺服器。"
      },
      {
        "icon": "💎",
        "iconType": "free",
        "title": "免費",
        "desc": "無限次表情符號複製貼上，無需註冊、無廣告、無付費牆。在任何裝置上隨心所欲地使用。"
      }
    ]
  },
  "specs": {
    "engine": "基於瀏覽器的表情符號選擇器 - 用戶端",
    "limit": "無限表情符號 - 所有標準 Unicode 類別",
    "logic": "搜尋 + 類別瀏覽 + 最近使用",
    "privacy": "100% 用戶端（僅最近使用記錄儲存於本地）"
  },
  "performanceMetrics": {
    "title": "技術規格",
    "metrics": [
      {
        "label": "類別",
        "value": "表情與人物、動物與自然、食物與飲料、旅行、活動、物品、符號、旗幟"
      },
      {
        "label": "搜尋",
        "value": "跨所有表情符號的關鍵字搜尋"
      },
      {
        "label": "膚色",
        "value": "支援人物和手部表情符號"
      },
      {
        "label": "複製",
        "value": "一鍵複製到剪貼簿"
      },
      {
        "label": "平台支援",
        "value": "任何支援 Unicode 表情符號的應用程式 (WhatsApp, Discord, Instagram, TikTok, iMessage 等)"
      },
      {
        "label": "隱私",
        "value": "無伺服器上傳；最近列表僅儲存在本地"
      }
    ]
  },
  "howToUse": {
    "title": "如何複製並貼上表情符號",
    "steps": [
      {
        "title": "瀏覽或搜尋",
        "desc": "使用左側的類別列表跳轉到特定區塊，或在搜尋框中輸入關鍵字以尋找表情符號。"
      },
      {
        "title": "選擇您的表情符號",
        "desc": "點擊您想要的表情符號。如果您需要為人物或手部選擇不同的膚色，請使用搜尋欄旁邊的膚色選擇器。"
      },
      {
        "title": "複製與貼上",
        "desc": "表情符號已複製到您的剪貼簿。使用 Ctrl+V（或 Mac 上的 Cmd+V）將其貼上到您的訊息、貼文或文件中。"
      }
    ]
  },
  "comparison": {
    "title": "為什麼選擇 Toolaze？",
    "toolaze": "Toolaze 💎",
    "others": "其他工具",
    "vs": "VS",
    "smartChoice": "聰明的選擇",
    "otherTools": "其他工具",
    "toolazeFeatures": "免費、無需註冊、類別瀏覽、搜尋、膚色選擇、一鍵複製、最近使用、在瀏覽器中運行",
    "othersFeatures": "需要註冊、類別有限、無搜尋功能、有廣告或付費牆、需下載 App、速度較慢、表情符號較少"
  },
  "scenesTitle": "使用場景",
  "scenes": [
    {
      "title": "簡訊與通訊",
      "icon": "💬",
      "desc": "將表情符號複製並貼上到 iMessage、WhatsApp 或任何聊天工具中。透過搜尋或類別快速找到正確的表情符號，一鍵發送。"
    },
    {
      "title": "社群媒體",
      "icon": "📱",
      "desc": "在 Instagram 說明、TikTok 簡介、Discord 訊息或 Twitter 貼文中使用表情符號。複製並貼上在每個平台上都能正常顯示的表情符號。"
    },
    {
      "title": "內容與文件",
      "icon": "📝",
      "desc": "在簡報、電子郵件或文件中加入表情符號。按關鍵字搜尋或按類別瀏覽，以複製並貼上完美的表情符號。"
    }
  ],
  "rating": {
    "title": "值得信賴的表情符號複製貼上工具",
    "rating": "4.9/5 來自 10,000+ 名使用者",
    "text": "「快速又簡單——我每天都在 Discord 和 Instagram 上使用它。」使用 Toolaze 線上複製貼上表情符號，無需註冊，無煩惱。"
  },
  "faqTitle": "常見問題",
  "faq": [
    {
      "q": "表情符號複製貼上真的是免費的嗎？",
      "a": "是的。Toolaze 表情符號複製貼上是 100% 免費的。您可以無限次複製並貼上表情符號，無需註冊、無廣告、無付費牆。"
    },
    {
      "q": "我可以在 iPhone 或 Android 上複製貼上表情符號嗎？",
      "a": "是的。在您的手機瀏覽器中打開 Toolaze 表情符號複製貼上頁面，點擊表情符號進行複製，然後將其貼上到任何支援表情符號的應用程式（如 iMessage、WhatsApp、Instagram 等）。"
    },
    {
      "q": "這些表情符號在 Discord、Instagram 和 TikTok 中可以使用嗎？",
      "a": "是的。這些表情符號是標準的 Unicode 字元，因此在任何地方都可以使用：Discord、Instagram、TikTok、WhatsApp、iMessage、Twitter 等。只需在需要的地方複製並貼上表情符號即可。"
    },
    {
      "q": "如何獲得膚色變化？",
      "a": "使用搜尋欄旁邊的膚色選擇器。它會出現在人物和手部表情符號中。選擇一個色調，然後點擊表情符號以該膚色進行複製貼上。"
    },
    {
      "q": "我的「最近使用」列表儲存在哪裡？",
      "a": "最近使用的表情符號僅儲存在您的瀏覽器（本地儲存）中。不會發送到我們的伺服器，因此您的使用情況保持私密。"
    },
    {
      "q": "我可以搜尋特定的表情符號嗎？",
      "a": "是的。在搜尋框中輸入關鍵字（例如「愛心」、「火」、「生日」）即可查看匹配的表情符號。然後點擊以複製並貼上您想要的那個。"
    }
  ],
  "moreTools": "更多快速工具"
}