{
  "in_menu": true,
  "metadata": {
    "title": "無料画像変換ツール - オンラインで画像をバッチ変換 | Toolaze",
    "description": "JPG、PNG、WebP形式間で画像を変換します。最大100枚の画像をバッチ変換可能。高速、プライベート、100%無料。会員登録不要。"
  },
  "sectionsOrder": [
    "howToUse",
    "features",
    "intro",
    "comparison",
    "scenes",
    "rating",
    "faq"
  ],
  "hero": {
    "h1": "無料の<span class=\"text-gradient\">画像変換ツール</span>",
    "desc": "JPG、PNG、WebP形式間で画像を変換します。最大100枚の画像をバッチ変換可能。高速、プライベート、100%無料。会員登録不要。"
  },
  "intro": {
    "title": "なぜToolaze画像変換ツールを使うのか？",
    "content": [
      {
        "title": "画質を落とさずに画像を変換",
        "text": "JPG、PNG、WebP形式間で画像を瞬時に変換します。ブラウザベースのコンバーターがローカルで画像を処理するため、完全なプライバシーと高速な変換が保証されます。Web開発者、デザイナー、コンテンツクリエイターに最適です。"
      }
    ]
  },
  "features": {
    "title": "強力な画像変換機能",
    "items": [
      {
        "icon": "📂",
        "iconType": "batch",
        "title": "バッチ処理",
        "desc": "一度に最大100枚の画像を変換"
      },
      {
        "icon": "🔄",
        "iconType": "formats",
        "title": "マルチフォーマット",
        "desc": "JPG、PNG、WebP、HEICに対応"
      },
      {
        "icon": "💎",
        "iconType": "free",
        "title": "100% 無料",
        "desc": "広告なし。"
      }
    ]
  },
  "howToUse": {
    "title": "Toolazeの使い方は？",
    "steps": [
      {
        "title": "画像をアップロード",
        "desc": "最大100枚の画像またはフォルダをドラッグ＆ドロップします。JPG、PNG、WebP、BMP、HEIC形式をサポートしています。"
      },
      {
        "title": "形式を選択",
        "desc": "ターゲット形式（JPG、PNG、またはWebP）を選択します。変換中も画質を維持します。"
      },
      {
        "title": "結果をダウンロード",
        "desc": "変換された画像を個別に、またはZIPファイルとして一括でダウンロードします。高速で効率的です。"
      }
    ]
  },
  "comparison": {
    "title": "なぜToolazeを選ぶのか？",
    "toolaze": "Toolaze 💎",
    "others": "他のツール",
    "vs": "VS",
    "smartChoice": "賢い選択",
    "otherTools": "他のツール",
    "toolazeFeatures": "最大100枚のバッチ処理, マルチフォーマット対応, 画質維持, 100%プライベート＆無料, 会員登録不要",
    "othersFeatures": "制限されたバッチサイズ, 形式の制限, 画質の低下, プライバシーの懸念, 会員登録が必要"
  },
  "scenesTitle": "活用シーン",
  "scenes": [
    {
      "title": "Web開発者向け",
      "icon": "💻",
      "desc": "パフォーマンス向上のために画像をWebPに変換。ページ読み込みの高速化とSEO改善のために形式を最適化します。"
    },
    {
      "title": "デザイナー向け",
      "icon": "🎨",
      "desc": "さまざまなデザインニーズに合わせて形式を変換。PNGで透明度を維持したり、JPGで最適化したりできます。"
    },
    {
      "title": "コンテンツクリエイター向け",
      "icon": "📱",
      "desc": "ソーシャルメディアやブログ用に画像をバッチ変換。すべてのプラットフォームでの互換性を確保します。"
    }
  ],
  "rating": {
    "title": "数千人のクリエイターに信頼されています",
    "rating": "4.9/5 - 1万人以上のクリエイターより",
    "text": "高速、安全、無料の画像変換でToolazeを信頼する数千人の満足したユーザーに加わりましょう。登録不要、100%プライベートな処理。"
  },
  "faqTitle": "よくある質問",
  "faq": [
    {
      "q": "どの画像形式がサポートされていますか？",
      "a": "ToolazeはJPG、PNG、WebP形式間の変換をサポートしています。JPG、PNG、WebP、BMP、またはHEIC形式の画像をアップロードできます。"
    },
    {
      "q": "このツールは本当に無料ですか？",
      "a": "はい！Toolazeは100%無料で、広告、登録、隠れた費用はありません。すべての処理はブラウザ内で行われます。"
    },
    {
      "q": "100枚以上の画像を変換できますか？",
      "a": "1セッションあたりの最大バッチサイズは100ファイルです。より多くの場合は、複数のセッションに分けて処理してください。"
    },
    {
      "q": "画像はサーバーにアップロードされますか？",
      "a": "いいえ！すべての画像変換はJavaScriptを使用してブラウザ内でローカルに行われます。画像がデバイスから離れることはなく、完全なプライバシーが確保されます。"
    },
    {
      "q": "変換中に画質は維持されますか？",
      "a": "画質の維持はターゲット形式に依存します。PNGはロスレスですが、JPGとWebPは非可逆圧縮を使用しますが、高い視覚的品質を維持します。"
    }
  ],
  "moreTools": "その他の画像変換ツール"
}